{
  "$schema": "local-image-bundle-manifest.schema.json",
  "schema_version": 1,
  "created_at": "2026-08-09T00:00:00Z",
  "image": {
    "tag": "noi-linux-official:2.0",
    "id": "sha256:0000000000000000000000000000000000000000000000000000000000000000",
    "source_revision": "0000000000000000000000000000000000000000",
    "labels": {
      "org.noi.desktop.contract": "finalizer-status-v1",
      "org.noi.iso.sha256": "1111111111111111111111111111111111111111111111111111111111111111",
      "org.opencontainers.image.revision": "0000000000000000000000000000000000000000"
    }
  },
  "archive": {
    "file": "noi-linux-official_2.0.tar.zst",
    "format": "docker-archive",
    "compression": "zstd",
    "sha256": "2222222222222222222222222222222222222222222222222222222222222222",
    "size_bytes": 123456789
  }
}
